Kartu ATM Anda diblokir. Hubungi segera nomor ini: 0882-2222-33322,SPAM dengan confidence 72.79%
"Halo Bu, rapat besok dimulai jam 09.00 ya, jangan lupa bawa laporan minggu lalu.",HAM (Bukan Spam) dengan confidence 61.18%
tes 123,HAM (Bukan Spam) dengan confidence 50.49%
Akun Anda akan diblokir. Segera verifikasi identitas Anda di tautan berikut.,SPAM dengan confidence 96.60%
"Jangan lupa besok ada ujian jam 8 pagi, belajar yang rajin ya!",HAM (Bukan Spam) dengan confidence 54.88%
Selamat! Anda memenangkan hadiah Rp10.000.000. Klik di sini untuk klaim: bit.ly/hadiahku,SPAM dengan confidence 96.45%
